Foundations of Information Technology,Information technologies (IT) and systems have emerged as the primary platform to support communication collaboration research decision making and problem solving in contemporary organisations. The essential necessity for all university students to acquire the fundamental knowledge and skills for applying IT effectively for a wide range of tasks is widely recognised. It is an introductory unit of study which prepares students from any academic discipline to develop the necessary knowledge skills and abilities to be competent in the use of information technology for solving a variety of problems. The main focus of this unit is on modelling and problem solving through the effective use of using IT. Students will learn how to navigate independently to solve their problems on their own and to be capable of fully applying the power of IT tools in the service of their goals in their own domains while not losing sight of the fundamental concepts of computing.,INFO1003,IT
Information Technology in Biomedicine,Information technology (IT) has significantly contributed to the research and practice of medicine biology and health care. The IT field is growing enormously in scope with biomedicine taking a lead role in utilising the evolving applications to its best advantage. The goal of this unit of study is to provide students with the necessary knowledge to understand the information technology in biomedicine. The major emphasis will be on the principles associated with biomedical data processing analysis visualisation registration modelling retrieval and management. A broad range of practical integrated medical image computing applications will be also elaborated.,COMP5424,IT
Machine Learning and Data Mining,Machine learning is the process of automatically building mathematical models that explain and generalise datasets. It integrates elements of statistics and algorithm development into the same discipline. Data mining is a discipline within knowledge discovery that seeks to facilitate the exploration and analysis of large quantities for data by automatic and semiautomatic means. This subject provides a practical and technical introduction to machine learning and data mining.,COMP5318,IT
Advanced Machine Learning,Machine learning models explain and generalise data. This course introduces some fundamental machine learning concepts learning problems and algorithms to provide understanding and simple answers to many questions arising from data explanation and generalisation. For example why do different machine learning models work? How to further improve them? How to adapt them to different purposes?,COMP5328,IT
Mobile Computing,Mobile computing is becoming a main stream for many IT applications due to the availability of more and more powerful and affordable mobile devices with rich sensors such as cameras and GPS which have already significantly changed many aspects in business education social network health care and entertainment in our daily life. Therefore it has been critical for students to be equipped with sufficient knowledge of such new computing platform and necessary skills. The unit aims to provide an in-depth overview of existing and emerging mobile computing techniques and applications the eco-system of the mobile computing platforms and its key building components. The unit will also train students with hand-on experiences in developing mobile applications in a broad range of areas.,COMP5216,IT
Web Application Development,Nowadays most client facing enterprise applications are running on web or at least with a web interface. The design and implementation of a web application require totally different set of skills to those are required for traditional desktop applications. All web applications are of client/ server architecture. Requests sent to a web application are expected to go through the public Internet which slows the responsiveness and increases the possible security threat. A typical web application is also expected to handle large number of requests coming from every corner of the Internet and sent by all sorts of client systems. This further complicates the design of such system.,COMP5347,IT
Object-Oriented Programming,Object-oriented (OO) programming is a technique that arranges code into classes each encapsulating in one place related data and the operations on that data. Inheritance is used to reuse code from a more general class in specialised situations. Most modern programming languages provide OO features. Understanding and using these are an essential skill to software developers in industry. This unit provides the student with the concepts and individual programming skills in OO programming starting from their previous mastery of procedural programming.,INFO1113,IT
Software Development in Java,Programming in a legible maintainable reusable way is essential to solve complex problems in the pervasive computing environments. This unit will equip students with foundation of programming concepts that are common to widely used programming languages. Students will be progressively guided in this introductory unit from necessary and important building blocks of programming to the object-oriented approach. Java one of the most popular programming languages is used in this unit. It provides interdisciplinary approaches applications and examples to support students from broad backgrounds such as science engineering and mathematics.,COMP9103,IT
Introduction to Programming,"Programming in a legible maintainable reusable way is essential to solve complex problems in the pervasive computing environments. This unit will equip students with foundation of programming concepts that are common to widely used programming languages. The ""fundamentals-first & objects-later"" strategy is used to progressively guide this introductory unit from necessary and important building blocks of programming to the object-oriented approach. Java one of the most popular programming languages is used in this unit. It provides interdisciplinary approaches applications and examples to support students from broad backgrounds such as science engineering and mathematics.",INFO1103,IT
Thesis B (extension) [not offered in 2019],Students enrolled in the Bachelor of Advanced Computing (BAdvComp) programs study various advanced aspects of Information Technology. The program may include lectures tutorials seminars and practicals. They will undertake a research focused project. Assessment will include the project and may include examinations and classwork.,INFO4003,IT
Data Analytics: Learning from Data,Technological advances in science business engineering has given rise to a proliferation of data from all aspects of our life. Understanding the information presented in these data is critical as it enables informed decision making into many areas including market intelligence and science. DATA2002 is an intermediate course in statistics and data sciences focusing on learning data analytic skills for a wide range of problems and data. How should the Australian government measure and report employment and unemployment? Can we tell the difference between decaffeinated and regular coffee? In this course you will learn how to ingest combine and summarise data from a variety of data models which are typically encountered in data science projects as well as reinforcing their programming skills through experience with statistical programming language. You will also be exposed to the concept of statistical machine learning and develop the skill to analyze various types of data in order to answer a scientific question. From this unit you will develop knowledge and skills that will enable you to embrace data analytic challenges stemming from everyday problems.,DATA2002,IT
Computer Science Project,The Computer Science project will provide students an opportunity to apply the knowledge and practise the skills acquired in the prerequisite and qualifying units in the context of designing and building a substantial software system in diverse application domains including life sciences. Students will need to demonstrate sensible application of computer science knowledge and skills in their project including deciding on most suitable data structure and algorithms algorithmic analysis for problem-solving methods for developing a robust efficient and secure system. Working in groups for an external client combined with academic supervision students will need to carry out the full range of activities including requirements capture analysis and design coding testing and documentation. Students will use the XP methodology and make use of professional tools for the management of their project.,COMP3888,IT
Computer Science Project (Advanced),The Computer Science project will provide students an opportunity to apply the knowledge and practise the skills acquired in the prerequisite and qualifying units in the context of designing and building a substantial software system in diverse application domains including life sciences. Students will need to demonstrate sensible application of advanced computer science knowledge and skills in their project including deciding on most suitable data structure and algorithms algorithmic design and analysis for complex problem solving methods for developing robust efficient and secure system. The students will work with a project with some complex problems that require advanced problem-solving methods techniques and skills (e.g. efficient algorithmic design for complex problems). Working in groups for an external client combined with academic supervision students will need to carry out the full range of activities including requirements capture analysis and design coding testing and documentation. Students will use the XP methodology and make use of professional tools for the management of their project.,COMP3988,IT
Computing 4 Innovation,The computing field is changing very rapidly. Innovation is continual with novel technology novel processes and novel business models. This unit prepares students for this aspect of their professional career with a focus on understanding the complex relationships between innovation ideas and business value. The Business Canvas Model will be used to make systematic the development of a case for business value. In particular students will hear guest lectures from industry innovators and they will learn about both successful and unsuccessful attempts to create business value from an innovative idea.,INFO4444,IT
Data Science Capstone Project,The Data Science Capstone project provides an opportunity for students to carry out a defined piece of independent research or design. These skills include the capacity to define a research or design question show how it relates to existing knowledge and carry out the research or design in a systematic manner. Students will be expected to choose a research/development project that demonstrates their prior learning in the data science domain (MDS). The results will be presented in a final project presentation and report. It is not expected that the project outcomes from this unit will represent a significant contribution to new knowledge. The unit aims to provide students with the opportunity to carry out a defined piece of independent investigative research or design work in a setting and manner that fosters the development of data science skills in research or design.,DATA5703,IT
Data Science Capstone A,The Data Science Capstone project provides an opportunity for students to carry out a defined piece of independent research or design. These skills include the capacity to define a research or design question show how it relates to existing knowledge and carry out the research or design in a systematic manner. Students will be expected to choose a research/development project that demonstrates their prior learning in the data science domain. The results will be presented in a final project presentation and report. It is not expected that the project outcomes from this unit will represent a significant contribution to new knowledge. The unit aims to provide students with the opportunity to carry out a defined piece of independent investigative research or design work in a setting and manner that fosters the development of data science skills in research or design. Eligible students for the Data Science Capstone project will be required to complete both DATA5707 (6 CPS) and DATA5708 (6 CPS) totalling 12 CPS.,DATA5707,IT
Data Science Capstone B,The Data Science Capstone project provides an opportunity for students to carry out a defined piece of independent research or design. These skills include the capacity to define a research or design question show how it relates to existing knowledge and carry out the research or design in a systematic manner. Students will be expected to choose a research/development project that demonstrates their prior learning in the data science domain. The results will be presented in a final project presentation and report. It is not expected that the project outcomes from this unit will represent a significant contribution to new knowledge. The unit aims to provide students with the opportunity to carry out a defined piece of independent investigative research or design work in a setting and manner that fosters the development of IT skills in research or design. Eligible students for the Data Science Capstone project will be required to complete both DATA5707 (6 CPS) and DATA5708 (6 CPS) totalling 12 CPS.,DATA5708,IT
Data Science Capstone Project – Individual,The Data Science Capstone project unit provides an opportunity for high-achieving students (WAM of 75+) to carry out an individual defined piece of work with academics of our school. The students will acquire skills including the capacity to define a project show how it relates to existing work and carry out the project in a systematic manner. Students will apply their gained knowledge of units of study in the data science domain (MDS). The results will be presented in a final project presentation and report. The unit aims to provide students with the opportunity to carry out an advanced project work in a setting and manner that fosters the development of data science skills in research or design.,DATA5709,IT
Business Information Systems,The Digital Economy with its focus on information as a key business resource has changed the way Business Information Systems (BIS) is viewed in organisations. BIS are now seen as enablers of innovation in which people supported by powerful technology are considered to be the most important component. This is because problem-solving innovation and critical thinking skills cannot be outsourced or easily acquired by competitors. This unit is designed to develop your understanding of how businesses operate. It shows how information systems support business operations and management through integration of people business processes and systems. You will be provided with an introduction to state-of-the-art business analysis techniques frameworks and models to assist in understanding the nature and contribution of BIS in a range of business contexts. With its emphasis on business rather than IT this unit does not require prior IT-related experience. In this unit you will learn about the increasingly important role of IT in business and acquire valuable business analysis and problem-solving skills.,INFS1000,IT
Multimedia Retrieval,The explosive growth of multimedia data including text audio images and video has imposed unprecedented challenges for managing big multimedia data. This unit provides students technologies on multimedia data management such as information retrieval multimedia data understanding multimedia data analytics. It will cover the basics of a search engine system as well as advanced topics such as multimedia retrieval multimedia content analysis and social media.,COMP5425,IT
Principles of Data Science,The focus of this unit is on understanding and applying relevant concepts techniques algorithms and tools for the analysis management and visualisation of data– with the goal of enabling discovery of information and knowledge to guide effective decision making and to gain new insights from large data sets.,COMP5310,IT
Data Analytics and Business Intelligence,The frontier for using data to make decisions has shifted dramatically. High performing enterprises are now building their competitive strategies around data-driven insights that in turn generate impressive business results. This course provides an overview of Business Intelligence (BI) concepts technologies and practices and then focuses on the application of BI through a team based project simulation that will allow students to have practical experience in building a BI solution based on a real world case study.,INFO5060,IT
Large Scale Networks,The growing connected-ness of modern society translates into simplifying global communication and accelerating spread of news information and epidemics. The focus of this unit is on the key concepts to address the challenges induced by the recent scale shift of complex networks. In particular the course will present how scalable solutions exploiting graph theory sociology and probability tackle the problems of communicating (routing diffusing aggregating) in dynamic and social networks.,COMP5313,IT
Information Technology Strategy & Value,The increasingly strategic role of IT in organisations is widely recognised. This unit of study is designed to provide a comprehensive introduction to strategic aspects of IT as they impact on business value.  Such a perspective is critical for IT professionals in both IT producer and user organisations from the level of Chief Information Officer to managers as well as technical specialists.  Deep understanding of IT strategy formulation and implementation and ensuring its alignment with the organisation’s strategic directions is important for successfully managing the major changes that the IT function has undergone in recent years.,INFO6012,IT
Information Technology Capstone Project,The Information Technology Capstone project provides an opportunity for enrolled part-time students to carry out an IT capstone project independently.  Students will be expected to choose an IT capstone project that demonstrates their prior learning in their advanced IT specialist domain (MIT) or the management of IT (MITM) or both technical and IT management domains (MIT/MITM) and apply them to the project. The learning outcomes are assessed by written reports (i.e. proposal progress report and final report).,COMP5703,IT
 Information Technology Capstone A ,The Information Technology Capstone project provides an opportunity for enrolled part-time students to carry out an IT capstone project independently.  Students will be expected to choose an IT capstone project that demonstrates their prior learning in their advanced IT specialist domain (MIT) or the management of IT (MITM) or both technical and IT management domains (MIT/MITM) and apply them to the project. The learning outcomes are assessed by written reports (i.e. proposal progress report and final report).,COMP5707,IT
Information Technology Capstone B ,The Information Technology Capstone project provides an opportunity for enrolled part-time students to carry out an IT capstone project independently.  Students will be expected to choose an IT capstone project that demonstrates their prior learning in their advanced IT specialist domain (MIT) or the management of IT (MITM) or both technical and IT management domains (MIT/MITM) and apply them to the project. The learning outcomes are assessed by written reports (i.e. proposal progress report and final report).,COMP5708,IT
IT Capstone Project - Individual,The Information Technology Capstone project unit provides an opportunity for high-achieving students (WAM of 75+) to carry out an individual defined piece of work with academics of our school.,COMP5709,IT
IT Research Project A,The Information Technology Research Project provides an opportunity for students to carry out a defined piece of independent research or design. These skills include the capacity to define a research or design question show how it relates to existing knowledge and carry out the research or design in a systematic manner. Students will be expected to define an original research project that demonstrates their prior learning in their advanced IT specialist domain (MIT) or the management of IT (MITM) or both technical and IT management domains (MIT/MITM). The results will be presented in a final project presentation and report.,COMP5702,IT
IT Research Project B,The Information Technology Research Project provides an opportunity for students to carry out a defined piece of independent research or design. These skills include the capacity to define a research or design question show how it relates to existing knowledge and carry out the research or design in a systematic manner. Students will be expected to define an original research project that demonstrates their prior learning in their advanced IT specialist domain (MIT) or the management of IT (MITM) or both technical and IT management domains (MIT/MITM). The results will be presented in a final project presentation and report.,COMP5704,IT
Enterprise Healthcare Information Systems,The intimate coupling of healthcare systems with ICT has been at the forefront of many of the medical advances in modern society over the past decade. As is already the case in many other service-driven sectors it is widely recognised that a key approach to solve some of the healthcare challenges is to harness and further ICT innovations. This unit is designed to help fill a massive technology talent gap in one of the biggest IT challenges in history: the technology transformation of healthcare.,INFO5306,IT
Major Development Project (Advanced),The Major Development project will provide students an opportunity to apply the knowledge and practise the skills acquired in the prerequisite and qualifying units in the context of designing and building a substantial software system in diverse application domains including life sciences. Students will need to demonstrate sensible application of computer science knowledge and skills in their project including deciding on most suitable data structure and algorithms algorithmic analysis for problem solving methods for developing robust efficient and secure system. Working in groups for an external client combined with academic supervision students will need to carry out the full range of activities including requirements capture analysis and design coding testing and documentation. Students will use the XP methodology and make use of professional tools for the management of their project.,INFO3600,IT
Concurrency for Software Development,The manufacturing industry has experienced a radical shift in the way they design computers with the integration of multiple processors on the same chip.  This hardware shift now requires software developers to acquire the skills that will allow them to write efficient concurrent software.  Software developers used to wait for manufacturers to increase the clock frequency of their processors to see increases in the performance of their programs the challenge is now to exploit in the same program more and more processing resources rather than faster processing resources. In this unit you will learn how to tackle the problems underlying this challenge including developing and testing concurrent programs  synchronizing resources between concurrent threads overcoming fairness issues and guaranteeing progress and ensuring scalability in the level of concurrency.,SOFT3410,IT
Knowledge Management Systems,The need to track and facilitate the sharing of the core knowledge resources in contemporary organisations is widely recognised.  This course will provide a comprehensive introduction to the area of Knowledge Management (KM) from both technological and organisational perspectives. We will review and discuss a range of published papers case studies and other publications that deal with important KM-related topics. One of the key knowledge management technologies Business Intelligence Systems will be covered in detail. It will also include hands-on work using the BI (Online Analytical Processing– OLAP) tool COGNOS and visualisation using Tableau. Some of the main themes to be covered will include: KM- Conceptual Foundations; Taxonomies of organizational knowledge and KM mechanisms; Case/Field Studies of KM Initiatives; Data Warehousing and OLAP/Business Analytics; Semantic Modelling and Knowledge Graphs; Social mediacrowdsourcing and KM; Big data and actionable knowledge.,ISYS5050,IT
Services Science Management and Engineering,The service economy plays a dominant and growing role in economic growth and employment in most parts of the world. Increasingly the improved productivity and competitive performance of firms and nations in services rely on effective design engineering and management of IT services.,INFO5991,IT
