Electrical Exchange Unit 2C,This is a unit of study for the University of Sydney students who have gone on exchange and are doing unit(s) with a syllabus that is equivalent to unit(s) of study in the School of Electrical & Information Engineering. The enrollment in this unit needs to be approved by the school. The enrollment in this unit will be granted for a workload that is equivalent to that of a (normal) full time student at the exchange university. Assessment is set by the exchange university. A Pass/Fail grade is awarded by the University of Sydney in this unit. Thus the marks obtained at the exchange university will not be included in any WAM calculations.,ELEC3906,Electrical
Electrical Exchange Unit 1A,This is a unit of study for the University of Sydney students who have gone on exchange and are doing unit(s) with a syllabus that is equivalent to unit(s) of study in the School of Electrical & Information Engineering. The enrollment in this unit needs to be approved by the school. The enrollment in this unit will be granted for a workload that is equivalent to one quarter of that of a (normal) full time student at the exchange university. Assessment is set by the exchange university. A Pass/Fail grade is awarded by the University of Sydney in this unit. Thus the marks obtained at the exchange university will not be included in any WAM calculations.,ELEC6901,Electrical
Electrical Exchange Unit 1B,This is a unit of study for the University of Sydney students who have gone on exchange and are doing unit(s) with a syllabus that is equivalent to unit(s) of study in the School of Electrical & Information Engineering. The enrollment in this unit needs to be approved by the school. The enrollment in this unit will be granted for a workload that is equivalent to one half of that of a (normal) full time student at the exchange university. Assessment is set by the exchange university. A Pass/Fail grade is awarded by the University of Sydney in this unit. Thus the marks obtained at the exchange university will not be included in any WAM calculations.,ELEC6902,Electrical
Electrical Exchange Unit 1C,This is a unit of study for the University of Sydney students who have gone on exchange and are doing unit(s) with a syllabus that is equivalent to unit(s) of study in the School of Electrical & Information Engineering. The enrollment in this unit needs to be approved by the school. The enrollment in this unit will be granted for a workload that is equivalent to that of a (normal) full time student at the exchange university. Assessment is set by the exchange university. A Pass/Fail grade is awarded by the University of Sydney in this unit. Thus the marks obtained at the exchange university will not be included in any WAM calculations.,ELEC6903,Electrical
Electrical Exchange Unit 2A,This is a unit of study for the University of Sydney students who have gone on exchange and are doing unit(s) with a syllabus that is equivalent to unit(s) of study in the School of Electrical & Information Engineering. The enrollment in this unit needs to be approved by the school. The enrollment in this unit will be granted for a workload that is equivalent to one quarter of that of a (normal) full time student at the exchange university. Assessment is set by the exchange university. A Pass/Fail grade is awarded by the University of Sydney in this unit. Thus the marks obtained at the exchange university will not be included in any WAM calculations.,ELEC6904,Electrical
Electrical Exchange Unit 2B,This is a unit of study for the University of Sydney students who have gone on exchange and are doing unit(s) with a syllabus that is equivalent to unit(s) of study in the School of Electrical & Information Engineering. The enrollment in this unit needs to be approved by the school. The enrollment in this unit will be granted for a workload that is equivalent to one half of that of a (normal) full time student at the exchange university. Assessment is set by the exchange university. A Pass/Fail grade is awarded by the University of Sydney in this unit. Thus the marks obtained at the exchange university will not be included in any WAM calculations.,ELEC6905,Electrical
Communications,This is an intermediate unit of study in telecommunications following on the general concepts studied in earlier units such as Signal and Systems and leading on to more advanced units such as Digital Communication Systems. Student will learn how to critically design and evaluate digital communication systems including the elements of a digital transmission system understand the limitations of communications channels different analog and digital modulation schemes and reasons to use digital techniques instead of analog and the effect of noise and interference in performance of the digital communication systems. On completion of this unit students will have sufficient knowledge of the physical channel of a telecommunications network to approach the study of higher layers of the network stack.,ELEC3505,Electrical
Communications,This is an intermediate unit of study in telecommunications following on the general concepts studied in earlier units such as Signal and Systems and leading on to more advanced units such as Digital Communication Systems. Student will learn how to critically design and evaluate digital communication systems including the elements of a digital transmission system understand the limitations of communications channels different analog and digital modulation schemes and reasons to use digital techniques instead of analog and the effect of noise and interference in performance of the digital communication systems. On completion of this unit studentss will have sufficient knowledge of the physical channel of a telecommunications network to approach the study of higher layers of the network stack.,ELEC9505,Electrical
Topics in Software Engineering,This Unit addresses software engineering practice in relation to modern complex systems as used in areas such as finance health power systems and communications.,ELEC5617,Electrical
Networked Embedded Systems,This unit aim to teach the fundamentals concepts associated with:,ELEC5514,Electrical
Intelligent Electricity Networks ,"This unit aims to give students an introduction to the planning and operation of modern electricity grids also known as ""smart"" grids. Traditional power networks featured a small number of large base-load plants sending power out over transmission lines to be distributed in radial lower voltage networks to loads. In response to the need to reduce carbon impact future networks will feature diverse generation scattered all over the network including at distribution levels. Also there will be new loads such as electric vehicles and technologies including energy storage and lower voltage power flow control devices. The operation of these new networks will be possible by much greater use of information and communication technology (ICT) and control over the information networks.",ELEC5208,Electrical
Object Oriented Application Frameworks,This unit aims to introduce students to the main issues involved in producing large Internet systems by using and building application frameworks. Frameworks allow great reuse so developers do not have to design and implement applications from scratch as students have done in ELEC3610 The unit lays down the basic concepts and hands on experience on the design and development of enterprise systems emphasizing the development of systems using design patterns and application frameworks.,ELEC5619,Electrical
Signals Software and Health,This unit aims to introduce students to the main issues involved in producing systems that use sensor data such as those from physiology and activity tracking often combined with patients self-reports. As sensing devices become ubiquitous data processing storage and visualization techniques are becoming part of all health systems both institutionalized and individually driven.,ELEC5622,Electrical
Digital Signal Processing,This unit aims to teach how signals are processed by computers. It describes the key concepts of digital signal processing and provides a background for modern signal processing systems which includes machine learning/artificial intelligence systems as well as data analytic systems. The primary paradigm is one of Analysis and Synthesis also referred to as Top-Down and Bottom-Up processing. The unit will focus on the traditional Fourier domain for analysis/synthesis but will touch on other domains such as wavelets and compressed sensing.  Students will be taught to work with and implement traditional filters and transforms working with real signals and systems. Completion of the unit will facilitate progression to advanced study in the area and to work with modern signal processing systems.,ELEC3305,Electrical
Digital Signal Processing,This unit aims to teach how signals are processed by computers. It describes the key concepts of digital signal processing including details of various transforms and filter design. Students are expected to implement and test some of these ideas on a digital signal processor (DSP). Completion of the unit will facilitate progression to advanced study in the area and to work in the industrial use of DSP.,ELEC9305,Electrical
Signals and Systems,This unit aims to teach some of the basic properties of many engineering signals and systems and the necessary mathematical tools that aid in this process. The particular emphasis is on the time and frequency domain modeling of linear time invariant systems. The concepts learnt in this unit will be heavily used in many units of study (in later years) in the areas of communication control power systems and signal processing. A basic knowledge of differentiation and integration differential equations and linear algebra is assumed.,ELEC2302,Electrical
Computer Control System Design [Not Offered 2019],This unit aims to teach the basic issues involved in the analysis and design of computer-controlled systems. The emphasis is on theory rather than technological application or industrial practice.,ELEC5303,Electrical
Fundamentals of Biomedical Engineering,This unit assumes a knowledge of basic principles in physics mathematics circuit theory and electronics. In particular some understanding of the following is required: Thevenins and Nortons theorems Fourier analysis radiation filtering bipolar and field effect transistors and operational amplifiers.,ELEC3802,Electrical
Optical Networks,This Unit builds upon the fundamentals of optical communication introduced in ELEC3405 (Communications Electronics and Photonics). It focuses on photonic network architectures and protocols network design enabling technologies and the drivers for intelligent optical network.,ELEC5512,Electrical
Error Control Coding,This unit deals with the principles of error control coding techniques and their applications in various communication and data storage systems. Its aim is to present the fundamentals of error control coding techniques and develop theoretical and practical skills in the design of error control encoders/decoders. Successful completion of this unit will facilitate progression to advanced study or to work in the fields of telecommunications and computer engineering. It is assumed that the students have some background in communications principles and probability theory.,ELEC5507,Electrical
Computer and Network Security,This unit examines the basic cryptographic building blocks of security working through to their applications in authentication key exchange secret and public key encryption digital signatures protocols and systems. It then considers these applications in the real world including models for integrity authentication electronic cash viruses firewalls electronic voting risk assessment secure web browsers and electronic warfare. Practical cryptosystems are analysed with regard to the assumptions with which they were designed their limitations failure modes and ultimately why most end up broken.,ELEC5616,Electrical
E-Business Analysis and Design,This unit examines the essential pre-production stages of designing successful internet websites and services. It focuses on the aspects of analysis project specification design and prototype that lead up to the actual build of a website or application. Topics include B2C B2B and B2E systems business models methodologies modeling with use cases / UML and WebML the Project Proposal and Project Specification Document Information Architecture and User-Centred Design legal issues and standards-based web development. Students build a simple use-case based e-business website prototype with web standards. A final presentation of the analysis design and prototype are presented in a role play environment where students try to win funding from a venture capitalist. An understanding of these pre-production fundamentals is critical for future IT and Software Engineering Consultants Project Managers Analysts and CTOs.,ELEC3610,Electrical
E-Business Analysis and Design,This unit examines the essential pre-production stages of designing successful internet websites and services. It focuses on the aspects of analysis project specification design and prototype that lead up to the actual build of a website or application. Topics include B2C B2B and B2E systems business models methodologies modeling with use cases / UML and WebML the Project Proposal and Project Specification Document Information Architecture and User-Centred Design legal issues and standards-based web development. Students build a simple use-case based e-business website prototype with web standards. A final presentation of the analysis design and prototype are presented in a role play environment where students try to win funding from a venture capitalist. An understanding of these pre-production fundamentals is critical for future IT and Software Engineering Consultants Project Managers Analysts and CTOs.,ELEC9610,Electrical
Engineering Electromagnetics,This unit introduces students to the broad spectrum of engineering electromagnetics and helps students to develop theoretical and analytical skills in the area of electrical and telecommunications engineering and develop understanding of the basic electromagnetic theory underpinning optical communications wireless communications and electrical engineering.,ELEC3104,Electrical
Engineering Electromagnetics,This unit introduces students to the broad spectrum of engineering electromagnetics and helps students to develop theoretical and analytical skills in the area of electrical and telecommunications engineering and develop understanding of the basic electromagnetic theory underpinning optical communications wireless communications and electrical engineering.,ELEC9104,Electrical
Real Time Computing,This unit is concerned with the theory and practice of real time computer systems as applied to the design of embedded systems and computer control systems in engineering manufacturing and automation.,ELEC5614,Electrical
Control,This unit is mainly concerned with the application of feedback control to continuous-time linear time-invariant systems. It aims to give the students an appreciation of the possibilities in the design of control and automation in a range of application areas. The concepts learnt in this unit will be made use of heavily in many units of study in the areas of communication control electronics and signal processing.,ELEC3304,Electrical
Control,This unit is mainly concerned with the application of feedback control to continuous-time linear time-invariant systems. It aims to give the students an appreciation of the possibilities in the design of control and automation in a range of application areas. The concepts learnt in this unit will be made use of heavily in many units of study in the areas of communication control electronics and signal processing.,ELEC9304,Electrical
Management for Engineers,This unit of study aims to develop an understanding of the principles and practices of industry. It provides an overview of the various issues facing an industrial organisation and of the basic approaches to their management.,ELEC3702,Electrical
Project Management,This unit of study aims to develop an understanding of the principles and practices of project management and engineering design industry to provide an overview of the various issues facing an industrial organisation and of the basic approaches to their project management.,ELEC4706,Electrical
Fundamentals of Electrical and Electronic Engineering,This unit of study aims to develop knowledge of the fundamental concepts and building blocks of electrical and electronics circuits. This is a foundation unit in circuit theory. Circuit theory is the electrical engineer’s fundamental tool.,ELEC1103,Electrical
Practical Introduction to Electrical Engineering,This unit of study aims to expose the students with fundamental (basic) concepts of different specializations within electrical engineering and give them hands on experience to develop the required engineering skills. The unit is based on extensive laboratory work covering Measuring skills using basic electrical instruments Soldering skills to make electronic circuits and test them Computer programming skills including real time programming and simulation programming Use of internet technology Wireless technology Renewable energy technology.,ELEC1004,Electrical
Electrical Energy Conversion Systems,This unit of study aims to give students a good understanding of electrical energy conversion techniques and equipment.,ELEC3206,Electrical
Electrical Energy Conversion Systems,This unit of study aims to give students a good understanding of electrical energy conversion techniques and equipment.,ELEC9206,Electrical
Power Electronics and Applications,"This unit of study aims to provide the fundamentals of power electronics. It provides description of the operation principles and control of these blocks. Through analysis and design methodologies it delivers an understanding of modern enabling technologies associated with energy conversion. Through laboratory hands-on experience on actual industrial systems such as electrical motor drives robotic arms and power supplies it enhances the link between the theory and the ""real"" engineering world.",ELEC3204,Electrical
Power Electronics and Applications,"This unit of study aims to provide the fundamentals of power electronics. It provides description of the operation principles and control of these blocks. Through analysis and design methodologies it delivers an understanding of modern enabling technologies associated with energy conversion. Through laboratory hands-on experience on actual industrial systems such as electrical motor drives robotic arms and power supplies it enhances the link between the theory and the ""real"" engineering world.",ELEC9204,Electrical
Gigabit Wireless Systems,This unit of study aims to provide the theory and design aspects of high speed and short-range wireless systems operating in the unlicensed frequency bands. The targeted system is at multi-gigabits per second within a 100m operating space. Typical applications include wireless local (or personal) area networks.,ELEC5515,Electrical
Electronic Circuit Design,This unit of study aims to teach students analysis and design techniques for electronic systems such as signal amplifiers differential amplifiers and power amplifiers. A background in basic electronics and circuit theory is assumed. Completion of this unit will allow progression to advanced studies or to work in electronics and telecommunication engineering.,ELEC9404,Electrical
Electronic Circuit Design,This unit of study aims to teach students analysis and design techniques for electronic systems such as signal amplifiers differential amplifiers and power amplifiers. Completion of this unit will allow progression to advanced studies or to work in electronics and telecommunication engineering.,ELEC3404,Electrical
Radio Frequency Engineering,This unit of study builds upon earlier work and provides an introduction to radio frequency components and systems used in wireless and satellite communications as well as in other high frequency applications. It assumes some knowledge of: basic circuit analysis; semiconductor device models and behaviour; transistor operation as switches and amplifiers; transistor operation as current sources and current mirrors; differential amplifiers.,ELEC5403,Electrical
Digital Integrated Circuit Design,This unit of study explores CMOS technology and integrated circuit design and fabrication. The fundamental theory and techniques behind digital integrated circuit design are introduced. A primary focus of this unit is providing the student with practical laboratory design experience using a professional VLSI CAD tool to design digital integrated circuits. This unit provides a foundation for more advanced digital integrated circuit design techniques and also analogue integrated circuit design.,ELEC5402,Electrical
Computer Architecture,This unit of study explores the design of a computer system at the architectural and digital logic level. Topics covered include instruction sets computer arithmetic performance evaluation datapath design pipelining memory hierarchies including caches and virtual memory I/O devices and bus-based I/O systems. Students will design a pipelined reduced instruction set processor.,ELEC3608,Electrical
Computer Architecture,This unit of study explores the design of a computer system at the architectural and digital logic level. Topics covered include instruction sets computer arithmetic performance evaluation datapath design pipelining memory hierarchies including caches and virtual memory I/O devices and bus-based I/O systems. Students will design a pipelined reduced instruction set processor.,ELEC9608,Electrical
Digital Systems Design,This unit of study explores the design of digital computing systems using hardware description languages. Topics covered include field programmable gate array (FPGA) architectures computer arithmetic high-speed digital logic interfacing computer architectures and case studies. Emphasis will be on how to design high-performance digital systems at the algorithmic system and logic level. Students are required to implement test and report on a digital design of moderate complexity.,ELEC5621,Electrical
Intelligent Visual Signal Understanding,This unit of study introduces basic and advanced concepts and methodologies in image processing and computer vision. This course mainly focuses on image processing and analysis methods as well as intelligent systems for processing and understanding multidimensional signals such as images which include basic topics like edge detection denoising and advanced topics like visual feature extraction and image classification as well as their applications for face recognition and object/scene recognition. It mainly covers the following areas: multidimensional signal processing fundamentals image enhancement in the spatial domain and frequency domain edge processing and region processing object recognition and detection.,ELEC5304,Electrical
Video Intelligence and Compression,This unit of study introduces digital image/video compression and understanding algorithms. This course mainly focuses on fundamental and advanced methods for digital video compression and understanding. It covers the following areas: digital video fundamentals digital image and video compression standards video codec optimization video understanding.,ELEC5306,Electrical
Advanced Signal Processing with Deep Learning,This unit of study introduces machine learning and deep learning technologies and their applications for a broad range of multi-dimensional signal processing applications. It covers basic machine learning technologies back-propagation network structure structure deep learning and the applications of deep learning technologies.,ELEC5307,Electrical
Introduction to Computer Systems ,This unit of study introduces the fundamental digital concepts upon which the design and operation of modern digital computers are based. A prime aim of the unit is to develop a professional view of and a capacity for inquiry into the field of computing.,ELEC1601,Electrical
Advanced Computer Architecture,This unit of study is comprised of a selection of topics covering advanced computer architecture advanced digital engineering and embedded systems. They may be chosen from the following:,ELEC5615,Electrical
Circuit Theory and Design,This unit of study is to build on the platform provided by the basic theory and technical units such as ELEC2104 Electronic Devices and Basic Circuits and ELEC2103 Simulation and Numerical Solutions in Engineering. Based on deep understanding of aspects in active analog filter design students are equipped with the knowledge and skills to design and to be in a good position to undertake further self study as required.,ELEC3105,Electrical
