Chemistry 1A (Special Studies Program),Chemistry describes how and why things happen from a molecular perspective. Chemistry underpins all aspects of the natural and physical world and provides the basis for new technologies and advances in the life medical and physical sciences engineering and industrial processes. This unit of study will further develop your knowledge and skills in chemistry for application to life and medical sciences engineering and further study in chemistry. You will learn about nuclear and radiation chemistry wave theory atomic orbitals spectroscopy bonding enthalpy and entropy equilibrium processes occurring in solutions and the functional groups in carbon chemistry. You will develop experimental design conduct and analysis skills in chemistry in small group projects. The laboratory program is designed to extend students who already have chemistry laboratory experience and particularly caters for students who already show a passion and enthusiasm for research chemistry as well as aptitude as demonstrated by high school chemistry results. Entry to Chemistry 1A (Special Studies Program) is restricted to a small number of students with an excellent school record in Chemistry and applications must be made to the School of Chemistry. The practical work syllabus for Chemistry 1A (Special Studies Program) is very different from that for Chemistry 1A and Chemistry 1A (Advanced) and consists of special project-based laboratory exercises. All other unit of study details are the same as those for Chemistry 1A (Advanced).,CHEM1903,Chemical
Chemistry A (Pharmacy),Chemistry provides the basis for understanding molecular structures and processes essential knowledge for many later year Pharmacy units of study. Lecture topics include some fundamental concepts atomic theory states and properties of matter equations and stoichiometry general acid-base theory atomic structure chemical bonding introduction to organic chemistry nomenclature aliphatic chemistry aromatic chemistry heterocyclic compounds isomerism stereoisomerism reaction mechanisms biomolecules amino acids and peptides carbohydrates. Practical work is designed to enhance confidence and develop skills in the handling and manipulation of chemicals and in the observation and processing of experimental results. Special preparative studies: Students wishing to enrol in CHEM1611 who do not have the assumed chemical knowledge are advised to consult the School of Chemistry for information about a bridging course (offered in February see http://sydney.edu.au/science/chemistry/studying-chemistry/bridging-course.shtml).,CHEM1611,Chemical
Chemistry 1B,Chemistry transforms the way we live. It provides the basis for understanding biological geological and atmospheric processes how medicines work the properties of materials and substances how beer is brewed and for obtaining forensic evidence. This unit of study builds upon your prior knowledge of chemistry to further develop your knowledge and skills in chemistry for application to life and medical sciences engineering industrial processing and further study in chemistry. You will learn about organic chemistry reactions structural determination nitrogen chemistry industrial processes kinetics electrochemistry thermochemistry phase behaviours solubility equilibrium and chemistry of metals. You will further develop experimental design conduct and analysis skills in chemistry through experiments that ask and answer questions like how do we develop lotions that don't burn us how do we measure UV absorption by sunscreens how can we measure and alter soil pH how are sticky things made and how do we determine the concentration of vitamin C in juice? Through enquiry observation and measurement you will understand the 'why' and the 'how' of the natural and physical world and will be able to apply this understanding to real-world problems and solutions. Chemistry 1B is built on a satisfactory prior knowledge of Chemistry 1A.,CHEM1102,Chemical
Chemistry 1B,Chemistry transforms the way we live. It provides the basis for understanding biological geological and atmospheric processes how medicines work the properties of materials and substances how beer is brewed and for obtaining forensic evidence. This unit of study builds upon your prior knowledge of chemistry to further develop your knowledge and skills in chemistry for application to life and medical sciences engineering industrial processing and further study in chemistry. You will learn about organic chemistry reactions structural determination nitrogen chemistry industrial processes kinetics electrochemistry thermochemistry phase behaviours solubility equilibrium and chemistry of metals.,CHEM1112,Chemical
Chemistry 1B (Adv),Chemistry transforms the way we live. It provides the basis for understanding biological geological and atmospheric processes how medicines work the properties of materials and substances how beer is brewed and for obtaining forensic evidence. This unit of study builds upon your prior knowledge of chemistry to further develop your knowledge and skills in chemistry for broad application including further study in chemistry.,CHEM1912,Chemical
Sustainable Chemical Manufacture,"Modern society is reliant on manufactured chemicals to meet our everyday needs in food production medicines clothing and technological applications. Traditional approaches to building molecules have largely ignored the detrimental environmental impacts of the manufacturing processes but this has changed. In this unit you will study contemporary methods used to create life-changing molecules from pharmaceuticals and bulk chemicals to polymers in the context of the environmental impact of chemical manufacture and the challenges of ensuring both sustainability of source materials and sustainability of waste treatment. You will gain an understanding of the principles and practices of chemical manufacture the application of catalytic processes and the methods used to tailor molecular properties including the spectroscopic and spectrometric techniques of chemical analysis. In this unit you will address the general issues of renewable and non-renewable resources and waste recycling. By doing this unit you will develop an integrated understanding of the challenges of sustainable chemical manufacture and the fundamental basis for continued study in the topics of organic synthesis environmental chemistry polymer science and industrial processes. These same lectures are also covered in CHEM2532 Concepts in Sustainable Chemical Manufacture but with the laboratory program replaced by a series of classroom workshops and assignments.
",CHEM2522,Chemical
Molecular Stability and Reactivity,"There are over 144 million chemical substances so far identified a diversity that makes possible the rich fabric of the material and biological worlds. Underpinning this huge diversity are a few fundamental rules of electronic arrangements in atoms and molecules that determine what molecules will be stable and when they will undergo transformation by chemical reaction. This unit will describe these fundamental rules and investigate how electronic rearrangements stabilise molecules by forming covalent bonds. You will investigate the quantum theory of bonding and apply these concepts to establish the rules that govern bond geometries aromaticity substitution and elimination reactions. You will investigate the bonding of metal complexes and the relation between magnetism and structure in these compounds. You will learn the fundamentals of electronic and vibrational spectroscopies and how these techniques are used to measure molecular properties. By doing this unit you will develop the fundamental understanding of chemical stability and reactivity essential for further work in all chemically related fields and have established a solid foundation for further study in chemistry.
",CHEM2521,Chemical
Architectural to Structural Design,CIVL4860 is a core final year unit for BE/BDesArch students aimed at enhancing students' skills in bridging between the architectural and engineering disciplines. The Unit will have a particular focus on developing strategies for how best to resolve the frequently conflicting interests and preferred concept solutions for addressing architectural and structural requirements for a building with given functions. Students will work in groups on developing final building designs from scratch from project briefs. Architectural and structural designs will be detailed in group presentations and reports.,CIVL4860,Civil
Transport Informatics,Data analytics: that is the examining raw data with the purpose of drawing conclusions about that information. The unit will cover the techniques and methods of collecting data designing data structures analysis of data and science-based inference from data.  These will be developed through real-world transport operations using available data bases and case studies of urban transport situations.,CIVL9704,Civil
Geoenvironmental Engineering,Geoenvironmental Engineering is an applied science concerned with the protection of the subsurface from human activities. It can be divided into 2 main branches: waste containment and treatment of pollution sites. The former is usually a preventative activity whereas the latter is corrective i.e. it occurs after pollution has taken place. Geoenvironmental Engineering draws on fundamental science especially the chemistry of low-permeability material such as clay fluid flow in soil and contaminant migration in soil. The goal of CIVL5351 is to introduce you to the science behind Geoenvironmental Engineering and develop your skills at designing waste containment systems.,CIVL5351,Civil
Geotechnical Hazards,Geotechnical hazards include landslides rock falls and mud flows. They are triggered by soil/rock failure due to natural or human causes. The objective of this Unit of Study is to develop the ability to assess and mitigate the risks associated to such events.,CIVL5453,Civil
Humanitarian Engineering,Humanitarian Engineering is the application of engineering to meet the needs of communities globally; while maintaining a focus on sustainability and appropriateness. This unit will give an introduction to engineers from all disciplines about the unique skills and knowledge needed to tackle challenges in; developing countries during all stages of disasters and indigenous communities. Achieving global sustainability is a consistent theme through-out the subject. The unit will develop skills in intra-disciplinary teamwork and cross-cultural competence. The subject is taught through a series of lectures based on real case studies and engaging guest seminars. Seminars presenters are all people who are currently working in the field of humanitarian engineering with representatives from industry government multi-lateral organisations and non-government organisations. This unit of study is the first lecture based subject in the Humanitarian Engineering major. The unit aligns as a 3rd year elective and is a prerequisite for 4th year subject in the Humanitarian Engineering major CIVL5320 Engineering for Sustainable Development.,CIVL3310,Civil
Humanitarian Engineering,Humanitarian Engineering is the application of engineering to meet the needs of communities globally; while maintaining a focus on sustainability and appropriateness. This unit will give an introduction to engineers from all disciplines about the unique skills and knowledge needed to tackle challenges in; developing countries during all stages of disasters and indigenous communities. Achieving global sustainability is a consistent theme through-out the subject. The unit will develop skills in intra-disciplinary teamwork and cross-cultural competence. The subject is taught through a series of lectures based on real case studies and engaging guest seminars. Seminars presenters are all people who are currently working in the field of humanitarian engineering with representatives from industry government multi-lateral organisations and non-government organisations. This unit of study is the first lecture based subject in the Humanitarian Engineering major. The unit aligns as a 3rd year elective and is a prerequisite for 4th year subject in the Humanitarian Engineering major CIVL5320 Engineering for Sustainable Development.,CIVL9310,Civil
Materials,Materials are an important part of the civil engineers' work. Indeed civil engineers who are concerned with the design construction and maintenance of facilities need to understand the behaviour and performance of the materials used. And as it happens mechanical properties– which are essential and basic for civil engineers– are highly dependent on the structure of materials at various scales. Therefore it is important that a student in Civil Engineering possesses a fundamental knowledge in materials science.,CIVL2110,Civil
Open Channel Flow & Hydraulic Structures,Objectives:,CIVL6666,Civil
Concrete Structures - Prestressed Concrete,Objectives: To develop an advanced understanding of the behaviour analysis and design of prestressed concrete structures.,CIVL6257,Civil
Rock Engineering,Objectives: to develop an understanding of the behaviour and design of engineering structures in rock masses.,CIVL6454,Civil
Rock Engineering,Objectives: to develop an understanding of the behaviour and design of engineering structures in rock masses. Outcomes: Students will have learnt how to classify and characterise rocks and rock masses for engineering purposes and developed an understanding of basic rock mechanics etc. Syllabus summary: Introduction to rock mechanics and rock engineering. Index properties and engineering characterisation of rocks and rock masses. Planes of weakness in rock masses. Rock material strength and rock mass strength. Rock deformability. In situ stress conditions in rock masses. Underground openings. Rock slopes.,CIVL5454,Civil
Analysis and Design of Pile Foundations ,Objectives: To develop an understanding of the modern principles of design of pile foundations and the application of those principles to practice.,CIVL6450,Civil
Fundamentals of Wind Engineering for Design,ObjectiveThis unit of study will introduce the fundamentals of meteorology governing wind flow details of extreme wind events wind structure statistical distribution of the wind the effect of topography and terrain changes on wind profile investigate the fluid flow around bluff bodies and detail the design of civil engineering structures for wind loading. This unit will provide students with the following knowledge and skills: On completion of this course students will have an understanding of the governing principles of wind engineering how to predict the extreme wind speed and analyse anemographs predict the effect of terrain and topography on velocity and turbulence understand flow patterns around bodies how to predict the pressure distribution and wind loading on bodies and structures dynamic response of structures and how all the above relates to AS1170.2.s:,CIVL5668,Civil
Concrete Structures - Prestressed Concrete,Students will understand the basic principles for the design of composite steel-concrete structures. In particular they will develop an understanding of the procedures required for the design of composite beams slabs and columns. Design guidelines will reflect requirements of the Australian Standards and international codes.,CIVL5257,Civil
Composite Steel-Concrete Structures,Students will understand the basic principles for the design of composite steel-concrete structures. In particular they will develop an understanding of the procedures required for the design of composite beams slabs and columns. Design guidelines will reflect requirements of the Australian Standards and international codes.,CIVL5264,Civil
Composite Steel-Concrete Structures,Students will understand the basic principles for the design of composite steel-concrete structures. In particular they will develop an understanding of the procedures required for the design of composite beams slabs and columns. Design guidelines will reflect requirements of the Australian Standards and international codes.,CIVL6264,Civil
Thesis A,The ability to plan systematically conduct and report on a major project involving both research and design is an important skill for professional engineers. The final year thesis units (Thesis A and Thesis B) aim to provide students with the opportunity to carry out a defined piece of independent research and design that fosters the development of engineering skills. These skills include: the capacity to define a problem; carry out systematic research in exploring how it relates to existing knowledge; identifying the tools needed to address the problem; designing a solution product or prototype; analysing the results obtained; and presenting the outcomes in a report that is clear coherent and logically structured.,CIVL4022,Civil
Thesis B,The ability to plan systematically conduct and report on a major project involving both research and design is an important skill for professional engineers. The final year thesis units (Thesis A and Thesis B) aim to provide students with the opportunity to carry out a defined piece of independent research and design that fosters the development of engineering skills. These skills include: the capacity to define a problem; carry out systematic research in exploring how it relates to existing knowledge; identifying the tools needed to address the problem; designing a solution product or prototype; analysing the results obtained; and presenting the outcomes in a report that is clear coherent and logically structured.,CIVL4023,Civil
Project Formulation,The aim of this UoS is to develop students’ ability to formulate projects through critically assessing & developing business case and project plan for a real-life engineering construction project. This UoS is relevant for students who intend to pursue career related to construction management. The learning activities focus on the project’s viability and early stage planning. Strategic needs and possible project options are identified and assessed based on potential benefits costs and the strategic context. Suitable site/route needs to be selected for the project based on technical and business considerations. Due consideration should also be given to the project’s impacts on environment and communities. The project’s viability can be indicated using Benefit-Cost ratio as well as non-financial indicators such as number of jobs created and the number of life saved. In deriving these indicators it is important to take project uncertainties into consideration through using techniques such as sensitivity analysis decision-tree analysis probabilistic modelling and Monte Carlo simulation. The objective is to justify investment decisions based on business needs and recommend the most appropriate course of actions to address the business needs.,CIVL4815,Civil
Capstone Project A,The capstone project requires the student to plan and execute a substantial research-based project using their technical and communication skills to design evaluate implement analyse and theorise about developments that contribute to professional practice thus demonstrating the achievement of AQF Level 9.,CIVL5020,Civil
Capstone Project B,The capstone project requires the student to plan and execute a substantial research-based project using their technical and communication skills to design evaluate implement analyse and theorise about developments that contribute to professional practice thus demonstrating the achievement of AQF Level 9.,CIVL5021,Civil
Capstone Project B Extended,The capstone project requires the student to plan and execute a substantial research-based project using their technical and communication skills to design evaluate implement analyse and theorise about developments that contribute to professional practice thus demonstrating the achievement of AQF Level 9.,CIVL5022,Civil
Project Procurement and Tendering,The general aim of this unit is to offer student the opportunity to develop an understanding of the procurement of built facilities and the methods of job allocation in project environments. Students will be engaged in a real construction case study project where key practical concepts which underpin procurement will be taught. At the end of this unit of study students should be able to: evaluate a client's procurement situation and apply an appropriate procurement route; explain how and why a particular procurement route is chosen; undertake procurement assessment exercises; analyze a contractor's strategic responses in tendering (bidding) decision-making; discuss why a particular bidding strategy is chosen in different contexts; and evaluate a contractor's bidding performance using competitor analysis techniques. The syllabus comprises fundamentals of building procurement assessment of procurement risks competitive bidding cost estimating the competitive environment in the construction industry contractors' competitive positioning contractors' decision-making in bidding competition bidding strategies and competitor analysis.,CIVL4814,Civil
Project Scope Time and Cost Management,The general aim of this unit of study is to offer the student the opportunity to develop an understanding of the scope time and cost management in project environments. Students will engage with some of the key concepts and various activities which underpin project scope time and cost management. At the end of this unit students will be able to: develop Work Breakdown Structure (WBS) develop network diagrams and undertake Critical Path Analysis (CPA) and Earned Value Analysis (EVA) using the given project information; explain in depth why scope time and cost management are important to project management; analyse a project situation that involves scope time and cost management issues; and explain how the components of scope time and cost management interrelate in project environments. The syllabus comprises the project planning cycle working with the project sponsor scope initiation and definition project scope definition tools WBS network scheduling techniques CPA Just-in-Time philosophy estimating and budgeting cash flow management EVA and application of project management software.,CIVL3805,Civil
Applied Fluid Engineering Computing,The objective of this unit is to provide students with advanced knowledge of Computational Fluid Dynamics (CFD) techniques and skills in solving thermal fluid flow problems relevant to Civil and Environmental Engineering applications. Students will also gain experience in using a state-of-the-art commercial CFD package and advanced understanding of a range of engineering problems through working on projects.,CIVL5669,Civil
Applied Fluid Engineering Computing,The objective of this unit is to provide students with advanced knowledge of Computational Fluid Dynamics (CFD) techniques and skills in solving thermal fluid flow problems relevant to Civil and Environmental Engineering applications. Students will also gain experience in using a state-of-the-art commercial CFD package and advanced understanding of a range of engineering problems through working on projects.,CIVL6669,Civil
Numerical Methods in Civil Engineering ,The objective of this unit is to provide students with fundamental knowledge of finite element analysis and how to apply this knowledge to the solution of civil engineering problems at intermediate and advanced levels.,CIVL5458,Civil
Mgmnt of People Quality and Risk in PE,The objective of this unit is to provide underpinning knowledge and skills in the application of tools to the project management environment for risk quality and people management including leading and managing project teams. At the end of this unit students will be able to understand and apply the tools of team building and project management leadership as well as apply tools for design and implementation of integrated plans for risk quality human resource and procurement. The competency level achieved will enable application of integration tools to a range of simple generic projects as well as provide input to plans for more complex projects. The syllabus comprises team management project leadership modern quality management principles and techniques quality assurance preparation of quality plans risk analysis planning and risk management as well as linking risk and quality management to human resourcing and procurement methodologies. The use of integrated planning software such as MS Project Gantt Project and social media tools for project management will be explained and practiced. The definitions and processes of Project Management will largely follow the US based Project Management Institutes PMBOK as is used in the Australian Institution of Project Management Standards at the level of Certified Practicing Project Manager (CPPM). Other International standards such as ICPMA's ICB3.0 standard will also be covered.,CIVL4810,Civil
Introductory Fluid Mechanics,The objective of this unit of study is to develop an understanding of basic fluid concepts for inviscid and incompressible fluids. Topics to be covered will include: basic fluid properties hydrostatics buoyancy stability pressure distribution in a fluid with rigid body motion fluid dynamics conservation of mass and momentum dimensional analysis open channel flow and pipe flow.,CIVL2611,Civil
